qid,query
361,irritability medical definition
9056,is defined as the causes of disease
9335,a monopolist is a price
11659,adjusted gross income definition
11721,admission cost to rock and roll hall of fame
13064,age for required minimum distribution
17458,ampulla of vater definition
18429,anniston post office phone number
20277,approved refund how long
20423,apush in what ways did the treaty of versailles embody wilson s fourteen points
22992,are humans still considered animals
23550,are marshmallows considered candy
23947,are nuts legumes
24168,are peas a carbohydrate
25375,are the galapagos islands volcanic rock
25899,are tortoise a native species in alabama
28892,at what speed does lane assist turn on
31222,average august temperatures in myrtle beach
31582,average canada tuition
34876,average cost per square foot to build a new home
37669,average income for executive assistants
40234,average percentage of accepted scholarships
43781,average savings per age group
43873,average settlement for hearing damage and loss
45125,average temperature in carlsbad nm
45364,average temperature in punta cana in march
46305,average toyota brake job
47680,average yearly salary for an accountant
48882,bartering definition
49174,batter definition
50891,benefits of hydrogenated water
50911,benefits of jamaican black castor oil
51090,benefits of oxygen pills
52844,biggest bear in the world
54425,blimpie sandwich calories
55550,bordj bou arr ridj province algeria
57147,buprenorphine sr
57614,by what process do lipid soluble hormones affect their target cells
57909,cable attenuation definition
58716,calculation of effective weight in water
60487,calories in large curly fry
62648,can a lp gas furnace be serviced
63896,can altitude sickness cause death
65806,can coconut oil cause constipation
66510,can disc herniation resolve
66835,can duckweed hurt your pond
67236,can eye strain cause your eye to twitch
69264,can i make late estimated tax payments
70113,can i use the expanded cb channels
70192,can i withdraw my 401k without penalty
70370,can insulin resistance cause hypoglycemia
70562,can kids drink protein shakes
70720,can led lights cause dizziness
74136,can sunburn cause a swollen lip
74328,can tennis elbow cause pain in your shoulder
74884,can trapped nerve cause pins and needles
75118,can unlicensed social workers be employed in mn
77441,can you find the order of a reaction with just knowing the rate constant
77878,can you get refunded on an amazon prime subscription
77972,can you give dogs pepto
79698,can you smell the alcohol in hard seltzer
80154,can you talk to people on snapchat on a computer
80181,can you tell if someone dreams about you
80747,can you use norton on more than one computer
82176,canoeing calories burned
82848,carnival cruise cheers prices
85053,causes for swollen ankle
85203,causes of aaa
85667,causes of burning pain and tingling
88339,causes of sialadenitis
91939,chisel is used for what
93455,clobetasol oint cost
93922,coastal digestive disease
94045,coconut yogurt calories
95089,comcast customer support number
95409,common causes for elevated liver enzymes
95512,common dagger types
96602,concomitant  definition
96886,conduct reference
98748,convert ml to oz
99697,corn definition
100307,cost analysis of school based obesity prevention program
100540,cost dozen donuts
103383,cost of copy paper case
104052,cost of file cabinet
106966,cost of septic system for 4 bedroom house
107674,cost of tuition and room and board at adrian college
108139,cost per credit hour at ksu
108828,cost to attend mount vernon nazarene university
109134,cost to buy points on jetblue
110571,cost to remove and replace a bathtub shower
112211,cpt code for us of a cyst
112272,cramping hyponatremia
113556,culture day in japanese
117431,define ala aeolian processes
118908,define cha cha rhythm
119046,define civil rights in terms of law
120192,define desolation
120724,define eavesdropping
120757,define ecomap
121580,define florida child safety methodology
124071,define minerals
126401,define remembered dialogue
127477,define stereograph
128071,define the congress of the united states
130423,definition conservatarian
134709,definition of first strike
134834,definition of full grain leather
135303,definition of hydrologist
135599,definition of interlocutory decree
138253,definition of society in sociology
138968,definition of totalitarianism
139119,definition of twister
141856,describe the standard form of a business letter
144285,did jonah die in the belly of the whale
144806,did pompeii know vesuvius was volcano
146169,difference between a knot and a hitch
148831,difference between stride and step length
149811,different kinds of bingo games
149813,different kinds of chain necklace
150019,different style of table skirting
151427,dilation angles of sand
154100,distance vision is called
155189,do beans have a lot of protein
156104,do egg white facials work
156672,do homes offer investment options
158764,do rider rewards expire
159931,do wild parrots name their babies
160092,do you capitalize spring  summer  etc
161129,do you pull a tooth when it s infected
162621,does adapter protect against power surge
162994,does american airlines charge for luggage
164182,does calcium carbonate have an odor
164924,does collagen protein work
165846,does eczema cause bumps
166468,does forskolin diet work
166680,does gerd cause coughing
166862,does grapefruit interact with effexor xr
167371,does hyperthyroidism cause you to be hot
167532,does inflatable neck traction work
167574,does insulin resistance cause inflammation
167971,does keratin grow hair
170762,does pyrethrum kill fruit flies
171740,does stinging nettle root work
172645,does the krebs cycle produce pyruvate
173969,does washing hands really help
175308,down side of owning a french bulldog
175854,drinking lots of water can help lose weight
177615,eating to prevent type 2 diabetes
178047,education cost at georgetown
179531,electrolysis chemistry definition
180640,english text to speech tts
182260,everett wa average rent
183723,explain how urinary tract infections cause both hematuria and pyuria
187311,firestorm synonym
188023,florida difference between felony and misdemeanor supervision
188968,foods that affect mood
189532,foods that help restore gut bacteria
189713,foods that produce gas and bloating
189869,foods to avoid after gallbladder is removed
191279,founders insurance claims number
191721,french last name meanings
192456,function of neurotransmitter
195244,global primacy definition
196228,government definition of insubordination
196596,granulocytes dendritic cells
197238,gross proceeds definition
197299,groundwater recharge zone definition
199572,head sores scalp
199692,healing the gallbladder naturally
201820,hifu facial treatment how long for results
202235,highest iq in europe
203405,hip is what kind of joint
204709,home security monitoring systems
204897,hometown foods inc
205107,honesty or integrity definition
207924,how are turkeys natural resources affected
208325,how big can a sunfish get
208822,how big is a micron
208836,how big is a normal sheet cake
211107,how can we conserve water
214040,how did mali gain its wealth
218000,how do i find my ip address
218550,how do i know if i have an intolerance to dairy
220170,how do rvus work
221426,how do you check your ketones
223603,how do you qualify for medicare
227317,how does programmatic buying work
229395,how expensive are purebred dogs
230675,how far is burbank airport to van nuys
231465,how far is la from las vegas
231506,how far is las vegas from grand canyon
232644,how far is war wv from princeton
233934,how fast does melanoma appear
236732,how is ginger good for my stomach
237370,how is sodium biacrbonate found naturally
239619,how long and what temperature to cook haddock in the oven
239683,how long are car loans typically
241151,how long can a company report a debt to your credit report
241300,how long can a lien stay on a property
241563,how long can an employer require you work overtime
242993,how long can you keep a ham in the freezer
244120,how long do ankle sprains hurt
244533,how long do children spend on technology
245939,how long do kids sore throat last
247717,how long do you cook pork tenderloin in oven
247872,how long do you grill bratwurst
249505,how long does a hair follicle test go back
249706,how long does a lien stay on property
254076,how long does it take for latex caulk to dry
259235,how long does pie filling last in the fridge
263261,how long is bachelor degree
264410,how long is recovery from hemorrhoid banding
267245,how long should should the attorney take to get bankruptcy filed
268019,how long to bake a salmon
268110,how long to bake chicken breast in oven at 375 degrees
268383,how long to bbq leg quarters
269345,how long to cook a stuffed bell pepper
275372,how many billions is trillion
276131,how many calories are in one serving of strawberries
276245,how many calories burned to lose 1 pound
276774,how many calories in a chef salad
277423,how many calories in dove hot chocolate
277969,how many calories jersey mike sandwiches
279195,how many characters can be written in a cell in excel
279229,how many chemicals has the fda banned in cosmetics in the us
279987,how many corn seeds per acre
281199,how many days does it take to complete an audit
281277,how many days for check to clear
282277,how many different combinations
283547,how many feet is a standard pickup bed
284150,how many gallons of water a year do people use showering
285605,how many hours a day do dogs sleep
286249,how many hours should a kitten sleep
286374,how many how species of butterflies
289249,how many milligrams of caffeine can be safely consume in one day
295261,how many seasons of the munsters
296987,how many stems in a bunch
297672,how many taxes do you pay when you withdraw from your ira
297710,how many teams are in the cfl
298608,how many times your salary can you borrow for a mortgage
299128,how many units of water per month
299393,how many vocaloids are there
300871,how many years does it take to get a psychiatry
301852,how much a mailing stamps
304016,how much csf fluid total
305109,how much do chiefs cheerleaders get paid
307694,how much do trauma surgeons
309148,how much does a criminal profiler make
309243,how much does a dentist charge for teeth whitening
309293,how much does a disney timeshare cost
311179,how much does a real estate agent make on a sale
315860,how much does it cost to hire a comedian
316215,how much does it cost to paint a house
316424,how much does it cost to redo floors in a home
316688,how much does it cost to replace an asphalt shingle roof
317819,how much does paving cost
318542,how much does the average smoker spend on cigarettes in a year
319445,how much fat is in a bubba burger
322779,how much is parking at the greater cincinnati airport
323628,how much is verizon s unlimited data plan
323645,how much is walmart stock
323946,how much longer after bachelors does a masters take
326002,how much pc data does an employee use each month
327025,how much salary for mpf
327367,how much should an architect charge
328704,how much times does your body need to recover
329121,how much to hire a wedding band
331141,how muxch do cdl endorsement tests cost
332248,how often should endurance and mobility training be conducted
332879,how old are gen z
344088,how to audit an accrual
347632,how to calm dog to be groomed
351678,how to convert class type to string and visa versa in c
355414,how to dispute late items on your credit
359483,how to find the volume of solid figure
360390,how to freeze fresh tomatoes
361473,how to get drivers permit in illinois
362380,how to get rid of algae in bird bath
362845,how to get student loans without a cosigner
366289,how to keep your nervous system safe
367290,how to make a afk pool minecraft
368117,how to make a trailer ramp
374021,how to protect yourself as an ebay seller
374698,how to reach verizon cell customer service phone number
375891,how to remove cat allergens from house
381361,how to stop beans from causing gas
381715,how to store unopened insulin
382980,how to test for gonorrhea
383002,how to test if binary tree is balanced
383768,how to treat burning figures
385354,how to use limits on stocks
386389,how to word thank you card for money gift
387326,how warm is vancouver island in july
388588,how working parents can stay involved when they have toddlers
390859,icl surgery how long until i can see
392195,if you jammed your finger what to do
393540,in millimeters what is the diameter of the scanning field of view  compound light microscope
399774,is a default gateway a router
401962,is alibaba a threat to amazon
402121,is aluminum a ferrous metal
403937,is basal cell malignant
406899,is columbia part of usa
407274,is cortana smart
408120,is devolving a word
409207,is elastic a fiber
409694,is evaporation an exothermic or endothermic process
410344,is flour carbs
411321,is goat milk good for you
411379,is google chrome up to date
412079,is hematuria signs of wbc in urine
412081,is hemochromatosis a recessive or dominant gene
412597,is hummus high in protein
413185,is iodine a necessary nutrient
413905,is it improper to give gifts to your lawyer
414815,is it worth it to buy a ps4 now
415504,is keratin a complete protein
416175,is legal shield a scam
416749,is lovenox lmwh or fondaparinux
416930,is lyme tuff grass
417902,is merrimack county part of state of nh
418765,is my cold contagious when i am outside around people
419477,is not eating a way to cure diarrhea
420503,is patriots day a legal holiday
421069,is plant protein a good source of protein
423423,is selling sales leads taxable utah
424843,is student loan interest tax a deduction or credit
424885,is sucrose artificial sugar
425072,is sweden switzerland
427814,is the word scripture capitalized
427964,is there a civil remedy for conspiracy
428773,is there a wunderlist app for android
429413,is this game of thrones final season
429453,is three meals a day good
430090,is tsp annuity taxed
430131,is tums good for stomach bloating
431114,is walking a good exercise
432455,itin number expired
432602,jackfruit recipe vegan
436548,largest gold and silver companies
437193,largest recorded tsunami
437222,largest rock in georgia
437293,largest ships in the future
437422,largest tech companies
438286,leadership coaching definition
441739,lockwood broadcasting
442525,longest mountain range in iran and iraq
443917,lynnwood temperature
447797,meaning of faint of heart
448124,meaning of latin genuit
450559,meaning pseudo
452034,medications for crohn s disease treatment
453869,militia definition and example
454884,minumum age to vote
455492,molecular substance definition
456560,most colorful places in the united states
457517,most effective otc yeast infection treatment
457714,most expensive hotels in new york city
458628,most popular dude ranches
458774,most popular news networks
459011,most powerful justice league members
459326,most shocking sports moment
459481,most used automation program
461078,nafta purpose and function
461451,name meaning naia
468989,one teaspoon minced fresh rosemary equals how much powder
470988,oxybutynin erectile dysfunction
471612,paragould ar population
474303,phase diagram definition
474610,phone number for etsy customer service
475340,pied noir definition
475448,pine nuts are good for
475610,pituitary apoplexy medical definition
475629,pixel density definition
476130,pm methodology definition
476415,polaris is in what constellation
477901,population of mason michigan
477975,population of monroe county pa
478666,pose  on definition
478691,positive effects of agriculture
479006,pounding heartbeat causes
479351,precambrian easy definition
479402,preclusion definition legal
480788,price of lava flair p1
481249,price stability refers to
482600,program definition omb
484136,purpose of the greivence committee
491351,salary average in south africa
492089,salary of phd professor
493143,saved by the bell idiom meaning
494474,seed sports definition
495630,sheep shearers
496056,shoujo manga definition
498674,sioux falls catholic school phone number
498889,size of average bearded dragon
500055,software definition
500563,sony xparia price
500865,sova surname meaning
501646,spleen pain symptoms in children
501805,spring bean definition annotation
506332,symptom of sinus
507199,symptoms of bowel full of stool
507381,symptoms of congenital heart defects
507638,symptoms of fifth metacarpal fracture
510308,taiwan dollars symbol
511999,temperature in cabarete dominican republic
515186,the definition of digest
519145,the three punctuation marks which can end a sentence are
519546,the yeti in bhutan
519867,things that happened in may 1986
520432,thyroid tsh levels
521204,time of day to take bp medication
521402,time travel theories
521552,time zone uganda
521849,titillate definition
521938,to bronze as a verb meaning
525009,true that people can die from a broken heart
526219,types of active transducers
527158,types of crown material
527176,types of currency of iceland
529032,types of olives greek
529618,types of round cell tumors in dogs
531101,typical weather auckland
532795,unravelled knots
534161,us steam llc
535479,valium iv onset of action
537500,visa versa
541109,was there a fire near big
541350,washington certificate of existence
543396,weather in bangkok in april
544950,weather in magaluf in september
545570,weather in plainwell  mi
545604,weather in portugal during the summer
546148,weather in tay ninh  vietnam fahrenheit
547598,weight of ez loader trailer
548604,westpac travel money card exchange rate
549942,what affects human growth rate
554738,what are all the chemical properties
555948,what are butterflies live
556814,what are comfortable walking shoes
556885,what are community based corrections
556954,what are computer applications
558109,what are educational synthesis courses
559157,what are full load cooling hours
559507,what are good leadership skills
562241,what are neeps and tatties
563032,what are pedigrees
564668,what are sensitive periods for brain development
564776,what are short segments of dna called
566108,what are sprinkles made of
568408,what are the components of tin
568665,what are the dates of expo east
571372,what are the major financial challenges of health care reform
571926,what are the names of the groups of the periodic table
572309,what are the parts of headphones called
573529,what are the side effects of using betamethasone dipropionate cream
575423,what are the units for volume of a cone
575674,what are the years considered a baby boomer
577806,what assumption must you make about the population distribution in order to construct the confidence interval estimate in  a
579087,what blood cells are called erythrocytes
582953,what can you use lemon curd for
583234,what car is the vacca in real life
583297,what carbohydrate provides structure for plants
584414,what causes a cell to swell  is it isotonic solution or what
585229,what causes alcohol for people to die
585464,what causes arterial stenosis
586425,what causes celiac disease
587538,what causes engine over cooling
590154,what causes nausea every day
591936,what causes spasms in lower back
592546,what causes the bottom of the feet to heat up
592672,what causes the lower back to bruise over the kidneys
593732,what causes you to feel a electric shock in your arm
593997,what causes stomach aches
594052,what celebrity has died
596717,what cleanses the kidneys
596840,what co garland tx
597216,what color are beets
599017,what colors would you use for a grey washed finish
602098,what county is 21227
602249,what county is alden ps in
603643,what county is buckhannon in
603647,what county is buckingham va in
606763,what county is greenwood maine in
607246,what county is highland park
609812,what county is morriston  florida
610497,what county is northville  mi
610942,what county is pacific grove ca in
612313,what county is san fernando ca
612626,what county is shalimar fl in
613223,what county is starkville  ms located in
613978,what county is upper marlboro md in
614121,what county is vidalia la in
615075,what county victoria  texas
615195,what courts consider in granting a preliminary injunction
616720,what day is cne
620558,what did vikings eat
620936,what discovery rule
622062,what do aviation mechanics make
623224,what do green jays eat
624800,what do sheet metal workers do
627416,what documents are required for learners permit
629639,what does a network infrastructure engineer do
631014,what does acrid mean
632404,what does aristocrats mean
632746,what does b v stand for netherlands
633712,what does bye
634004,what does cash bar mean
634038,what does catalyze
634071,what does cca rating on a car battery mean
635809,what does depressing respiration mean
636151,what does do stand for for a doctor
636861,what does encumbered mean
637020,what does eradicate mean
637301,what does extinct mean
638430,what does granite d
638977,what does hmo pos mean
639447,what does impact testing measure
640740,what does it mean to have liability insurance only
641597,what does it mean when your urine is a dark color and it smells
642845,what does malamutes mean
643449,what does mirabeau mean
645024,what does oxygen and hydrogen make
648150,what does sod cost per square yard
653682,what does the word spelled euphemism mean in how is it pronounced
655369,what does yellow stand for
658512,what exactly does a cbc with diff test for
659208,what famous art does the louvre have
659517,what field is a dentist in
659966,what flower symbolizes new beginnings
660940,what foods are good for skin
661092,what foods are rich in vitamin d
661597,what foods have l glutamine in it
666733,what happens to the human body if you never drink water
668229,what health benefits does turmeric have
669700,what hotel was on fire in the dells
671108,what ingredient is in tylenol
673117,what is a  pt ptt coagulation cascade needed
674089,what is a bakery clerk
674634,what is a bic code italy
676015,what is a c major scale on a guitar
677972,what is a cobble
680448,what is a database management system
684903,what is a glove box on car dash
685336,what is a good natural remedy for cold sores
685628,what is a gout diet
685722,what is a gram formula mass
685821,what is a grecian
686770,what is a heterogeneous mixture  give one example
686904,what is a hit and run in softball
687602,what is a interneuron
689822,what is a main spice or seasoning used in thai food
691321,what is a mode in math terms
691665,what is a mountain cur dog breed
692148,what is a navy bso
692257,what is a nephrologist vs urologist
695800,what is a precis
697488,what is a recapture agreement on real estate
698146,what is a rf isolator used for
698912,what is a saros cycle
700187,what is a situation that poses a level of threat to life  health  property  or environment
701390,what is a static character in literature
702278,what is a supplier certification program
702363,what is a suspicious transaction when accounting
702419,what is a swing loader
704072,what is a transit number
704719,what is a uim claim
706000,what is a waterfall benchtop
706204,what is a whale tail
706480,what is a work ethic
708158,what is ademco
708619,what is aetherium
708904,what is agm mean
709340,what is alcohol syndrome
709936,what is aluminum sulfate
713950,what is an escrow
715157,what is an indemnity insurance claim payment
715231,what is an industrial zone
715508,what is an integrated studies degree
715588,what is an interlude
718738,what is antimicrobial activity
719372,what is aquapiston flushing technology
720013,what is arzoo
723293,what is bentonite  what is montmorillonite
725690,what is brand for escitalopram oxalate generic
728836,what is cefazolin used to treat
729618,what is charged caffeine
730834,what is citadel investment group
731759,what is cobol
732454,what is commodity
732834,what is computer hard drive
732958,what is concrete detail
738444,what is democracy quizlet
738894,what is deterrence
740203,what is disparate
740268,what is distilled spirits
740849,what is domperidone
740926,what is donkey kong the first nintendo video game ever
741970,what is dynamic resolution
744784,what is escitalopram oxalate
744826,what is esl course
746121,what is factoring
746260,what is family centered approach
746599,what is fdm group
747136,what is fica taxable
748348,what is food coloring
749319,what is fst
749365,what is fuel service exe
750617,what is gentiva carecentrix inc
751778,what is gomorrah
751813,what is good about being invisible
753577,what is happening in tampa in february
756462,what is hydrocodone
757125,what is icsc
758405,what is in urine for gun powder
762767,what is kalpasi
766867,what is loose cough
767273,what is lung aspiration
767671,what is made from beaver fur
768072,what is malarone
768541,what is marine
768933,what is mastic gum
770604,what is medicare pps
771662,what is mfr
771899,what is micronase
773090,what is mojo for marketing
773759,what is motivation  importance  concept and types
775975,what is negritude
776375,what is neuromuscular therapy massage
776722,what is nickelodeon slime
776968,what is nj charity care
777156,what is non identifying information adoption in nys
777297,what is noritake m
777338,what is normal blood glucose
777652,what is normal platelet count
778487,what is ny sales tax internet orders
778525,what is nystatin cream used for
781901,what is patella tendinitis
782479,what is pembroke pines fl
782549,what is pennsylvania s minimum wage
782692,what is perceptive content software
783507,what is phonophobia
785842,what is pott s disease
786021,what is ppp
787856,what is pseudo cushings syndrome
789294,what is radioablation
793593,what is santos
794667,what is secondary succession
794685,what is secretariat saf
796049,what is sidereal rotation
796145,what is sikaflex
796209,what is silicon at room temperature
797860,what is solar cell
798768,what is spiritual beliefs
