qid,query
798974,what is spring onions
800831,what is suffix
801029,what is suny tuition credit
802038,what is tah bso
802326,what is tardus parvis
803237,what is terminal velocity for humans
803306,what is test for hep c
804192,what is the advantage of fha loan
804358,what is the age of majority in louisiana
804706,what is the altitude of mauna kea on the big island of hawaii
805900,what is the average cost of a home in santa rosa california
813494,what is the culture and society in australia
814132,what is the daily sodium limit
816396,what is the difference between a graduate program and an undergraduate
817128,what is the difference between cd r and cdrw
818512,what is the difference between teas
819416,what is the dosage for propranolol for anxiety
820213,what is the empirical formula for caffeine
820526,what is the etemology of anglo saxon
820909,what is the fastest car in the
821624,what is the fistula
822492,what is the function of growth hormones
824355,what is the harvest
826382,what is the irs allowance for mileage
826613,what is the joint commission
827852,what is the leading port city of belgium
829025,what is the lowest credit score for an fha loan
829103,what is the lunula purpose
829856,what is the margin of error formula
831372,what is the meaning of political
832370,what is the medication apap
834174,what is the mrc foundation
835239,what is the name of the indianapolis airport
836098,what is the negeb
836252,what is the new jumbo mortgage limit
838116,what is the origin of the word punk
839692,what is the popping in my shoulder
842055,what is the purpose of a release mark
842070,what is the purpose of a sds
842171,what is the purpose of an action plan
844002,what is the relationship between the respiratory system and the muscular system
845007,what is the routing number on my check
846996,what is the size of carry
847278,what is the smallest unit of length
850406,what is the temperature of melting point
851304,what is the time length of a baseball game
851527,what is the tortuosity factor
851763,what is the treatment for hand foot mouth disease
852203,what is the uigea form
852850,what is the value of mercury
853064,what is the voltage of a tesla battery pack
854737,what is the y intercept
855972,what is ti dmd
856250,what is titanium found and used in
858617,what is ua rbc test
861199,what is virile agitur
864510,what is your mcl in your knee
864698,what is yucca mountain
864953,what is zixcorp
864980,what is zoho com
865078,what is zurcon used for
865255,what island is there a dolphin experience
865284,what islands are in the gulf
866050,what kind glue can i use to fix pool liner
866212,what kind of anesthesia is used for colonoscopy
867514,what kind of doctor to choose for primary
870814,what kind of sugar is galactose
874876,what makes a community healthy
875503,what makes humans special beings
875945,what makes up retained earnings
876274,what marketing managers do
876366,what material are pipeline made from
877892,what metals work with magnets
878698,what month do you hear the baby heartbeat
879150,what movements strain the trapezius
879788,what muscles are cut during unicondylar knee replacement
885932,what percent of the world s population is india and china
887283,what plant is ephedra
887494,what platforms does matlab run on
889050,what program deploys scripts
890175,what radio station is wyyd
891121,what report in quickbooks cannot be exported to excel
891161,what requirements must be met for a taxpayer to qualify to file as head of household
892262,what salvage value means in depreciation
892438,what school district is blacklick  ohio
892917,what season was the simpsons bart to the future made
893144,what serious illness counts for fmla
893994,what should the appropriate insanity defense be
894511,what side is the cerebrum
894752,what sim card for iphone 4
895333,what size is a dl envelope
897928,what state is sayulita in
897954,what state is starling city located
899672,what substances are released into the air as a result of a volcanic eruption
900164,what system does straight talk use
901834,what temperature is bad for wine
903062,what tests are included on bmp
904402,what time does day end
905110,what time is preakness
905690,what time zone is illinois in
906435,what to do if bill of lading is lost
906796,what to do when car is totaled in accident
906849,what to do when someone is having a heart attack
907563,what to feed african cichlids
908489,what tool to use to take off lambs tails
908753,what town is shirley ny in
914234,what type of reaction is used to make a polypeptide chain
915339,what type ofwood is recon veneer made out of
917750,what was a major result of the second great awakening
922338,what was the reason of the growth of literacy
923492,what websites can you book travel and do payment plans
929302,what zone does purple shamrock grow
929530,what s a chinchilla
931083,what s the average temperature in las vegas
931296,what s the cure for the sunburn
931307,what s the current president of mexico
931386,what s the definition of a tween
931476,what s the definition of recessive in science
931710,what s the difference between freeways and highways
932639,what s the official language of qatar
933290,what s the theory of relativity
933295,what s the thymus
934566,whats the age limit for the military
935438,when and why does dna replication happen
936266,when can dogs go on the beach in swanage
936407,when can i start collecting social security
936701,when can you give blueberries to baby
940201,when did paint it black come out
941185,when did the army use spec ranks
942157,when did the retreat of the germans at the battle of arras happen
944410,when do palisade peaches harvest
946903,when does madden release w ea access
948467,when does the water table rise
950773,when is it time for aortic valve replacement
952926,when is the i fall solstice
953925,when last did we have a solar eclipse
953966,when may bedpans be needed
954547,when should i pick peppers
955117,when the northern hemisphere experiences summer  the southern hemisphere experiences
959854,when was slash and burn agriculture used
960003,when was stew invented
961048,when was the first known japanese animation produced
961535,when was the king james bible printed
961796,when was the marseillaise written
961921,when was the national park system established
963095,when was wortham established
963992,when will people start to harvest in iowa
964054,when will social security cost of living increase
964152,when will the hurricane be available in star citizen
964631,when you punch someone in the mouth does your fist hurt after
965383,where are fulmer helmets made
965578,where are john deere compact tractors made
965807,where are morning
966114,where are red blood cells stored in the body
967374,where can a child volunteer in dc
968921,where did last names originate
969605,where did the incas live
969958,where did the term roger originate
970167,where did whippersnapper originate
970562,where do cicada live in world
971253,where do mussels come from year
971957,where do velvet ants live
972813,where does costco build
972823,where does creativity come from
974818,where does the powerball drawing take place
976941,where is ansilvund burial chambers
977770,where is battle creek michigan
978132,where is big bend
979572,where is cavendish  nl
984454,where is highlands tx
986197,who was the choir director for grace cathedral in san francisco
986857,where is longviw texas
987671,who said never let a tragedy go to waste
987825,who produced black panther
988144,who passed the legal drinking age
988146,who painted his self portrait in blue
988976,who is the ceo of baptist hospital in pensacola  florida
991938,where is royal swim located
991946,definition of eeo job categories
992096,who developed haccp plan
992224,who came up the the saying the iron curtain
992261,who argued for evolutionary cultural progress from savagery through civilization
992430,whitney routing number louisiana
992433,white pine millings in wv
992730,which type of muscle is found in the wall of hollow organs
992802,which type of combat order precisely and cocisely explains the mission  the commander s intent  and concept of how to accomplish the mission
993147,which snakes have neurotoxins
993472,where is stanchfield mn
993587,which plants live in the sonoran desert
993714,which parish is kentwood in
993795,amazon consumer services number
993943,which of the following is a valid use of eminent domain
993959,which nose is the most attractive
995042,where is the clackamas county fair held
995187,which county is fonda ny in
995552,which celebrated author invented valentine s day
995645,where is the freehand hotel in chicago
995895,which are common causes of dysrhythmias
996058,definition of adjacent
996409,where is the lincoln navigator built
996569,where to find olive trees
997533,where is the sea of cortez located
997708,where is the source of the amazon river
998062,where is the total solar eclipse visible
998490,where is milton kentucky
998641,where is long john silver located in goldsboro nc
998675,where is lewisburg
998713,where is keaka dr in honolulu
998802,where is iron located in a plant body
998868,where is trachea located
998903,where is grozny
999207,where is ulster ireland
999386,where is bursa
999843,where does the siberian tiger live
1000406,where do lark buntings live
1000528,define  gluteal
1000728,where is youtube located headquarters
1001818,where are kiducation drop boxes
1001929,where are axon hillocks located
1001936,where and in what city is chapultepec located
1002220,when were headlights first used scholar
1002714,define trivium
1003021,when was etrade established
1003132,define theory in regards to sociology
1004034,when is kirby star allies release date
1004566,when does the follicular phase
1004761,when does petrol freeze
1005075,when does american chopper air
1005167,when do you fly a flag at half mast
1005775,which b vitamin is folate
1005787,which baby graced the first edition
1005940,when did the news report the attack on pearl harbor
1006000,when did the civil rights movement beyond
1006745,when did hurricane irma hit st  thomas
1006845,when did general mills acquire epic bars
1006893,define poikilocytosis
1007150,which college offers a pharmacology course in new york city
1007608,when are flags flown at half staff
1007901,whats the weather in san antonio
1008344,define pada
1008930,what s the meaning of kokua
1009216,what s the definition of business casual
1009746,define mycologist
1009831,what s a data bus
1010505,define metalpoint
1010626,what year did the first ipad come up
1010628,what year did the first car seat for babies
1010833,what year did jumanji come out
1011292,what were the reasons for the u s prohibition
1011321,define lipemic serum
1011381,what were the browns and other families asking the supreme court to do
1011819,which is produced by nuclear fusion
1011864,what was the purpose of the student nonviolent coordinating committee
1011875,define jar
1012399,which is worse for your kidneys aleve or tylenol
1012431,what was the company s net revenues for the year
1012641,what was one of the problems faced by the united states after world war ii
1013797,what types of animals live in the tropical zone
1013862,what type of work can a person living with schizophrenia do
1014095,which nsaid is best for atmospheric sinus headache
1014157,what type of species is a conch
1014681,what type of memory holds data when power is off
1014781,which of the following hormones is released by the adrenal gland during stress
1015072,which of the following is an example of a low impact activity
1015227,what type of insulation and drywall for basement
1015294,define flitch
1015339,what type of government does cyprus have
1015615,which of the following processes can be called orographic lifting
1016615,define ecosphere
1016666,what town is islip terrace in
1016873,what to use for iron overload
1016973,what to plant in the spring
1017072,what to include on basic resume
1017541,what to do after wrist cast comes off
1017694,which populations contain children with edwards syndrome
1018056,what time is it in lemoore  ca
1018099,define cron job
1018830,what the aztecs used as money
1019658,what structure prevents the shrinking or swelling of plant cells
1019936,define carotid stenosis
1020231,define brain stem
1020266,which states get the most welfare money
1020467,what size is the largest flat rate box
1021168,what season is scorpius most clear in
1022091,what products contain hafnium
1022173,what prison is located near crescent city  ca
1022379,what pokemon can breed with pikachu
1022716,what percentage of the us population owns a gun
1022735,what percentage of people in the world speak english
1022759,what percentage of california population growth is due to illegal immigrants
1022774,what percentage is the sales tax in erie colorado
1022832,what percent of blood plasma
1023715,what oils to diffuse for mold
1023832,what numbers can standard deviation be
1024169,who are the group       locash
1024411,who are the reptilians
1024466,who are the texas senators
1025313,who coined the term follow the money
1025348,who coined the term thagomizer aaaa
1025699,who created reddit
1025991,what lake in mn is the deepest
1026693,what kind of plant tissue does a bud contain
1026776,what kind of medical test shows stomach issues
1027223,who does cleft palate surgery
1027669,who first brought up global warming
1027884,what kind of anesthesia is used for cataract surgery
1027919,what kind idea had wovoka
1027920,what keys on the keyboard rotate a monitor
1028111,what islands are part of the north american continent
1028131,who has absolute monarchy
1028156,what island is hispaniola
1028243,dannemora prison escape cost
1028691,who invented fabric softener
1028749,what is water s properties
1028752,what is watamote
1029247,what is turkey tail used for
1029402,what is treeno software
1029770,what is the zip for chapel hill  nc
1030665,what is the us operation in kuwait
1030786,what is the typical diet of a dancer
1030862,alabama board of architects
1031033,what is the theory that cause continents to move
1031694,what is the sum of the angle measures in a triangle
1031695,what is the sum of measure of interior angles
1031907,what is the standard thickness of a guitar pick
1032084,what is the speed limit on a rural interstate highway unless otherwise posted
1032451,what is the school district for polk city   iowa
1032622,what is the salary of a congressman in the u s  house of representatives
1033096,what is the redemption period in foreclosure
1033199,what is the rank for major general
1033535,what is the purpose of the addie process
1034157,what is the price of a rainbow carpet cleaner attachment
1034166,what is the prf
1034193,what is the porter scandal
1034270,what is the population of snowflake az
1034674,what is the ph in soil for utah
1035526,who is m  waddington
1035768,what is the mthfr enzyme function
1036141,what is the minimum amount to get the earned income tax credit
1036385,what is the meaning of weber
1036540,what is the meaning of finding grasshopper
1036663,what is the meaning of calculus politics
1036721,what is the meaning behind loy krathong
1036862,what is the material layer used within the vacuum bag pressure system to absorb excess resin during curing called
1037915,what is the j code for reclast
1038306,what is the horizontal ruler in word
1038723,what is the green flag with yellow diamond
1038724,what is the greatest source of bank income
1039676,what is the final destination of lymph
1039691,what is the fdle
1039818,county where youngstown is located
1039837,who is the current commander of the international space station
1040092,what is the easiest way to lose weight
1040763,what is the difference between element
1041086,what is the dictionary meaning for the word passion
1041520,what is the definition of p
1042068,what is the current time in upper arlington  ohio
1042280,what is the county for junction city kansas
1042353,who is tin leg insurance co
1042735,who is vmware
1043327,what is the cause of bilateral ankle swelling
1043658,what is the bracket
1043906,what is the best web browsers
1043940,what is the best type of soil for plant growth
1043955,what is the best shovel to dig palms
1043965,what is the best protein to eat
1044090,what is the best headlamp
1044175,what is the bag called that holds feces in after surgery
1044245,what is the average starting salary for a rn in michigan
1044254,what is the average salary for neonatal nurses
1044375,what is the average kwh used in house per day
1044499,who makes whirlpool appliances
1044505,what is the average american iq score
1044524,what is the average a baby s weight
1045242,what is tennessee famous people
1045357,what is taxwatch
1045387,what is tantamount
1045416,what is tacsei
1045541,what is supply chain management and optimization
1045590,what is subtweeting
1045874,cost of shipping a memorial wreath
1045957,what is sound made out of
1046019,what is solid formed from atoms arranging themselves in a repeating pattern is called a what
1046383,what is short term rental
1046384,what is shock for pool
1046508,what is scholar s path application
1046637,what is sandy hook shooting
1046689,what is sacubitril valsartan
1047139,what is return address in a business letter
1047166,what is reset in retail
1047912,what is prima
1048358,what is phulkari
1049286,what is obstructive bowel syndrome
1049314,who represents the president in the budget making process
1049470,what is normal range for waist to hip ratio
1049960,cost of an ice cream truck
1049983,what is needed for photosynthesis occur
1050420,what is musical setting
1050670,who sing the song just swinging
1050724,who sings all in a day s work on styk album
1051110,what is methylchloroisothiazolinone used for soap
1052059,what is liberty hill  texas zip code
1052196,what is larger kb versus mb
1052214,what is landing gear
1052627,who started legalism
1052673,what is japan movement
1053188,what is insured first name
1054257,what is haemolysis
1054372,what is group policy used for
1054527,what is goch
1054597,what is ginger good for is ginger for digestion
1055973,what is embezzling
1056376,what is dook
1056537,what is djibouti s economy
1056674,who was the original host of hardball on msnbc
1056736,what is developer hair
1056776,who was the producer for wall of voodoo
1056881,what is delavirdine
1058329,what is cogs
1058451,what is cls for army
1058604,what is chromium bro
1058731,what is check forgery
1058834,what is cdpap in home care
1058896,who wrote the eagle has flown  as
1059403,what is braid initiative
1059871,wht are magnesium supplements used for
1060341,what is batti
1061182,why are the first 20 elements important to the periodic table
1061194,what is asthma causes
1061752,what is aquamarine stone
1061990,what is another word for pursuant
1062319,what is an synonym for careful
1063968,what is alma observatory
1064206,color of urine
1064302,what is afrofuturism
1064834,why do i need a fistulogram
1064961,collages definition
1065872,what is a trojan
1066009,what is a tranche
1066760,code switching definition
1066762,what is a swedish dishcloth
1066966,what is a studio room in assisted living
1068383,why does wheatgrass cause diarrhea
1068715,what is a protocol examples
1068924,why hemorrhagic disease tests due to vitamin k deficiency in infancy
1069297,what is a physical form
1069327,what is a phooka
1069747,what is a normal atom of nitrogen s mass number
1069981,what is a mustelidae
1070452,what is a mimo receiver
1072652,what is a grace period for fsa
1073250,why jamestown was important
1073549,what is a fire card
1073686,citizenship cost
1073784,why publish in nursing quality journal
1073801,what is a example of the carbohydrate
1073805,what is a example of a indicator
1074025,why should school sports not be banned
1074992,what is a cypress tree
1075021,what is a curettage
1076673,what is a backflow test for a city
1077102,what insurance plans cover silver sneakers
1078964,what happens when you do disorderly conduct
1079198,chief mouser to the cabinet office definition
1079806,what geographical region is the black mesa in in oklahoma
1080871,checkpoint definition
1081109,what food do green sea turtle
1081432,yoga to aid bowel
1082244,what enzyme covalently connects segments of dna
1082313,what education you need to be a safety inspectors
1082340,age for advair hfa
1082453,ceramics industry
1082482,what does tornadoes mean
1082494,central violation of probation
1082508,what does the word zealous
1082607,what does the state bird mean in louisiana
1082700,what does the nature of diagnosis mean
1082822,what does the coronary septum separate the heart into
1082834,what does the brush in curling do
1082944,what does statutes mean
1083010,what does simple circuit contain
1083021,what does short term memory do for us
1083049,what does sdh stand for medical
1083116,what does revenues  sm  mean
1083136,what does recursion mean
1083275,what does pcd stand for in cardiology
1083292,what does pagination mean
1083340,against what part of the electromagnetic spectrum does sunscreen protect
1083416,what does misprision mean
1083436,what does medicare a  b  and d cover
1083452,what does manage mean
1083510,what does lasix do
1083533,what does jos a bank stand for
1083583,what does it mean to be catty
1083717,what does halters mean
1083743,what does greek small letter psi represent
1083855,what does extent mean
1083894,what does email address mean
1084066,what does cm risk mean
1084402,aflatoxin definition
1084537,cat declaw cost
1084728,cast of serendipity
1084808,what do grizzlys eat
1084819,what do fireflies use their bioluminescence for
1084852,what do chinese do with their dead people
1084922,what direction do you drive roundabout
1084943,what did the term scalawag refer to during reconstruction
1085094,what degree does someone die of hypothermia
1085109,what deficiency causes thin nails
1085233,what county is waskom texas
1085286,what county is shiremanstown  pa in
1085295,what county is sebring fl in
1085326,what county is ridgway  pa
1085356,what county is plainfield  indiana in
1085449,what county is malone florida in
1085454,what county is lumberton  nc
1085477,what county is lake wales  florida
1085495,what county is jefferson nc
1085506,what county is hydro ok in
1085528,what county is hamlin wv located in
1085645,what county is bryant in sd
1085740,what could a cough mean
1085769,what constitutes investment income
1086051,what causes the end of leaves to turn brown on a peace lily
1086089,what causes repulsion
1086188,what causes duane s syndrome
1086289,what cause dehydration
1086311,what cancers only affect white blood cells
1086323,what can you do for team building
1086369,what can cause intense pain on your right side
1086371,what can cause congestion in the chest
1086378,what can cause blood clots in the bladder
1086384,what can be used in place of a coffee filter
1086524,what atoms are in a chlorofloro molecule
1086533,what assets do harley davidson have
1086555,what are your upper two teeth called
1086769,what are the symptoms of potassium depletion
1086828,can diabetes cause cracked heels
1086890,what are the primary emotions in psychology
1086931,what are the most popular interior door styles
1087003,what are the ingredients for trimspa
1087078,what are the differences in humidifiers
1087139,what are the building setbacks for cheboygan county michigan
1087261,what are some of the causes for black spots in your vision
1087547,what are insurance requirements for florida drivers
1088011,wernicke symptoms
1088073,wedi shower pan sizes
1088074,wedding venues in barcelona spain
1088107,weather report in champaign illinois
1088123,weather of tai
1088251,weather in saratoga county
1088311,weather in pensacola florida
1088344,weather in niigata japan
1088386,weather in marbella costa del sol spain
1088644,weather in campinas sao paulo
1089157,unsaturated fat is in what form at room temperature
1089220,ucc  definition of commodity accounts
1089287,types of phosphating
1089301,burn pit side effects
1089340,types of digester
1089434,tribals definition
1089446,treatment of mesothelioma cancer
1089476,tracfone is owned by what company
1089515,budd metroliner
1089627,time costa
1089710,the study of touch is called
1089747,the ostrich war
1089775,the meaning of the greek word locus
1089953,that s swell meaning
1090022,temperature in kyiv
1090024,temperature in june for las vegas
1090060,temperature cheshire ct
1090127,taping cost
1090184,synonym of subordinate
1090243,symptoms of ptsd avoidance
1090261,boudinaged in geology define
1090383,stm and ltm capacity definition
1090515,spectacles define
1090529,sousveillance definition
1090587,snoopy comic meaning of life
1090592,snap shares price
1090695,side effects for sacubitril
1090760,shaking meaning
1090881,satsui no hado meaning
1090946,ryan tax compliance phone number
1091035,rhetorical functions
1091094,reject define
1091106,reflection from smooth surfaces called                  reflection
1091130,really thick phlegm how is it caused
1091330,price to get cat spayed
1091566,placebo effect is real
1091638,phone number for walgreen on randall rd  lake in the hills
1091735,permutation meaning
1091739,periscope define
1091872,paid prioritization definition
1091941,osmosis can be defined as
1091980,optimization meaning
1092007,on what date did the japanese launch pearl harbor
1092043,ocd what means
1092081,benefits of tomatoes skin
1092504,most frequent number in powerball
1092577,moribund definition
1092602,montgomery county iowa population
1092726,midas headquarters
1092789,memory lost meaning
1092816,medications to control itching in dogs
1092988,meaning of per diem amount
1092989,meaning of pension
1093069,meaning of decorum
1093078,meaning of culinary
