qid,query
1093138,mdlg meaning
1093142,md health connection contact number
1093152,mayans where did they live
1093153,may average temperature for alaska
1093160,maxalt pill price
1093201,acrylamide cas number
1093216,marcasite define
1093230,manganese deficiency symptoms in humans
1093281,luxury homes fort worth
1093321,longhorn apartments fort worth
1093354,acromiodeltoid function
1093422,limitations of secondary sources
1093453,lemmings live in what region
1093481,leaf miner definition in horticulture
1093528,largest volcano on a planet
1093611,laphroaig meaning
1093709,acoelomate define
1093727,juno technical support phone number
1093809,isoelectric point of protein is the ph at which
1093845,is weak dollar good
1093886,is the weather nice in may in thailand
1094075,is mrsa always on skin
1094133,bag and tag meaning
1094188,is correlation measurable
1094189,is copper hydroxide
1094191,is common law marriage legal in what states
1094227,is ash a hardwood
1094281,irs how much do you have to claim to have medical expenses
1094374,integrated bar definition
1094500,in what ways can coal be used
1094510,in what way are cities microclimates
1094576,in the definition of psychology  the term mental processes means
1094730,average weather by month lake charles  la
1094925,average ton per year of pollution from passenger vehicles
1095288,how old do you have to be a bookseller at barnes and nobles
1095339,how often do you have to renew your nh license
1095340,how often do you do oil change
1095407,how much to rent napkins
1095542,how much rain does phoenix get in a year
1095572,how much people die for pollution every year
1095724,how much magnesium do you need
1096070,how much does it cost to replace brake pads
1096092,how much does it cost to get associate degree in accounting
1096159,how much does an epidemiologist make a year with a ph d
1096188,average propensity to save  aps  definition
1096191,how much does a simple tax filing cost at h   r block
1096320,average population of san diego
1096321,absolute risk reduction vs risk difference
1096431,how much beef is eaten in the us
1096444,average pay for rn in north dakota
1096509,how many years back to the clinton tax returns go
1096510,how many years are companies required to keep dot records
1096555,how many us space shuttles are there
1096668,how many sold records is diamond
1096702,how many school shootings in us ytd
1096920,average implants cost
1096957,how many men have walked on the moon wiki
1096983,how many lieutenant colonels in us army
1097151,how many feet is a tiger
1097152,how many feet in an acre side
1097291,how many days are in february in leap year
1097361,abducens nerve palsy causes
1097373,how many children are identified with autism according to the cdc
1097376,average cost to replace an alternator
1097434,how many cans does it take to make a pound of aluminum
1097501,average cost of spaying a cat
1097627,how long will jupiter transit scorpio
1097849,how long should dogs sleep a day
1097858,how long should a scrambled egg cook in a microwave
1098002,how long is a baby bracelet
1098016,average beagle weight chart
1098082,how long does the senior driver safety course last
1098197,how long does it take to cook an egg in the oven
1098212,how long does it take jupiter to spin once on its axis
1098408,how long does a friendship last
1098433,how long do you sear boiled octopus
1098440,how long do you keep flag at half mast
1098646,how long can it take to heal a peptic ulcer
1098650,how long can i leave butter at room temp
1098745,how long ahead of flight to arrive at airport
1098846,how is rose quartz used etc
1098855,how is polymyalgia rheumatica diagnosed
1098992,at what age should children go to funerals
1099098,how early should you arrive for a flight
1099175,how does stroma work
1099324,how do you know if it is a chemical change
1099349,asparagus meyeri
1099364,how do target cells recognize hormone
1099368,how do spirits manifest themselves
1099425,how do i describe a physical change
1099630,how can peptic ulcers cause bleeding
1099658,how big is lake taupo
1099902,hip hop miami cast
1099985,heroic realism
1100017,height of volleyball players
1100076,hbo hd channel number
1100088,hawaii state fmla
1100089,hawaii state federal credit union scholarship
1100121,haqqani network who
1100150,habeas corpus refers to
1100193,greek meaning of titus
1100260,glenoid labral tear causes
1100265,gizmo meaning
1100269,giddins claman langs llp
1100275,get define
1100292,gentiles definition
1100299,generic lotrel side effects
1100316,gastrectasis definition
1100399,frostpunk release
1100413,arbitrability definition
1100559,a         is a pictorial representation of the chromosomes in a cell
1100580,fin de siecle meaning
1100632,fastest lambo
1100737,exact engineering
1100809,enticement laws definition
1101036,drafter what is it
1101127,annual illegal immigration cost
1101148,does your fps have to much your refresh rate
1101294,do enzymes reach the diffusion controlled limit
1101297,do cpa s charge for filing or preparing
1101332,displacement transducer definition
1101360,direct rule imperialism definition
1101502,difference between fluid and flowing
1101514,difference between consent and authorization
1101535,diff types of fuses
1101663,dental hygiene assistant salary in texas
1101672,dendrobium bellatulum
1101678,deltic diesel locomotive
1101679,amount of protein in cauliflower
1101698,amount of mucus produced each day
1101753,zombie by the cranberries meaning
1101851,witchcraft defined
1101948,why use single page app
1101971,why say the sky is the limit
1102112,why is exercise beneficial to your heart
1102168,why have basic income
1102280,why do we use moving average
1102285,why do we pay social security taxes
1102309,definition of risk mapping
1102358,why do i feel cold when
1102413,why do a ferritin level
